<?xml version="1.0" encoding="UTF-8"?>
<iz:Izvestaj xmlns:iz="http://www.pijz.rs/izvestaj"
 xmlns:vc="http://www.w3.org/2007/XMLSchema-versioning"
 xmlns:cmn="http://www.pijz.rs/common"
 xmlns:xsi="http://www.w3.org/2001/XMLSchema-instance"
 xsi:schemaLocation="http://www.pijz.rs/izvestaj file:/D:/College/XML%202020/Project/XML-2020/data/xsd/izvestaj.xsd" id="ID000" sluzbenikID="sluzbenikID0">
    <iz:metadata>
        <cmn:meta property="property0" content="content0">meta0</cmn:meta>
        <cmn:meta property="property1" content="content1">meta1</cmn:meta>
        <cmn:meta property="property2" content="content2">meta2</cmn:meta>
    </iz:metadata>
    <iz:brojPodnetihZahteva>0</iz:brojPodnetihZahteva>
    <iz:brojOdbijenihZahteva>0</iz:brojOdbijenihZahteva>
    <iz:brojZalbiOdluka>0</iz:brojZalbiOdluka>
    <iz:zalbe>
        <iz:zalbaID>ID001</iz:zalbaID>
        <iz:sadrzaj>sadrzaj0</iz:sadrzaj>
    </iz:zalbe>
    <iz:zalbe>
        <iz:zalbaID>ID002</iz:zalbaID>
        <iz:sadrzaj>sadrzaj1</iz:sadrzaj>
    </iz:zalbe>
    <iz:zalbe>
        <iz:zalbaID>ID003</iz:zalbaID>
        <iz:sadrzaj>sadrzaj2</iz:sadrzaj>
    </iz:zalbe>
</iz:Izvestaj>
