<?xml version="1.0" encoding="UTF-8"?>
<iz:Izvestaj xmlns:iz="http://www.pijz.rs/izvestaj"
 xmlns:vc="http://www.w3.org/2007/XMLSchema-versioning"
 xmlns:cmn="http://www.pijz.rs/common"
 xmlns:xsi="http://www.w3.org/2001/XMLSchema-instance"
 xsi:schemaLocation="http://www.pijz.rs/izvestaj file:/D:/College/XML%202020/Project/XML-2020/data/xsd/izvestaj.xsd" id="ID000" sluzbenikID="sluzbenikID0">
    <iz:metadata>
        <cmn:meta property="iz:brojZalbiOdluka" content="18"></cmn:meta>
    </iz:metadata>
    <iz:brojPodnetihZahteva>18</iz:brojPodnetihZahteva>
    <iz:brojOdbijenihZahteva>6</iz:brojOdbijenihZahteva>
    <iz:brojZalbiOdluka>10</iz:brojZalbiOdluka>
    <iz:zalbe>
        <iz:zalbaID>ID001</iz:zalbaID>
        <iz:sadrzaj>Садржај прве жалбе.</iz:sadrzaj>
    </iz:zalbe>
    <iz:zalbe>
        <iz:zalbaID>ID002</iz:zalbaID>
        <iz:sadrzaj>Садржај друге жалбе.</iz:sadrzaj>
    </iz:zalbe>
    <iz:zalbe>
        <iz:zalbaID>ID003</iz:zalbaID>
        <iz:sadrzaj>Садржај треће жалбе.</iz:sadrzaj>
    </iz:zalbe>
</iz:Izvestaj>
